{
  "rule_id": "fixture-rule-001",
  "rule_version": "1",
  "release_id": "rel:20261001-1",
  "rule_content_hash": "fedcba9876543210fedcba9876543210fedcba9876543210fedcba9876543210",
  "evidence_refs": [
    "fixture"
  ],
  "schema_version": "rule-0.1",
  "engine_version": "0.1.0",
  "eligibility": "unknown",
  "payout": {
    "kind": "undetermined",
    "conditional_amount": {
      "kind": "range",
      "min_krw": 1000000,
      "max_krw": 2000000
    }
  },
  "missing_inputs": [
    "elapsed_calendar_days"
  ],
  "trace": [
    {
      "path": "eligibility",
      "op": "all",
      "result": "true"
    },
    {
      "path": "amount",
      "op": "multiply_rate",
      "result": "5000000 KRW"
    }
  ],
  "input_snapshot_hash": "0123456789abcdef0123456789abcdef0123456789abcdef0123456789abcdef"
}
